<?xml version='1.0' encoding='iso-8859-1' ?>

<!DOCTYPE template PUBLIC
  "-//StudioGdo//DTD Stencil 1.0//EN" "stencil.dtd">

<template java="com.gdo.project.cmd.Nothing">
	<description>
		Allow stencil modification.
		Select stencils from "Source"
		slots.
	</description>

	<!-- model part -->
	<slot name="Source" arity="*">
		<description>slot path where the selected stencils can be found (for
			selection)</description>
		<description>should be redefined (usually delegated slot)</description>
	</slot>

	<!-- used in rendering the command -->
	<prop name="StencilType" type="string">
		<data>stencil</data>
	</prop>

	<!-- presentation part -->
	<prop name="Title" id="title" />

	<!-- Modification Step -->
	<inst id="_1" template="com.gdo.project.model.StepStcl">
		<prop name="Title" id="step1.title" />
		<prop name="Render" id="step1.render" />
	</inst>

	<plug ref="_1" key="1" slot="Steps" />

</template>
