<?xml version='1.0' encoding='iso-8859-1' ?>

<!DOCTYPE template PUBLIC
  "-//StudioGdo//DTD Stencil 1.0//EN" "stencil.dtd">

<!-- todo should extends Modify -->
<template java="com.gdo.project.cmd.Nothing">

	<description>
		Set the default parameters for the service.
	</description>
	<params_description />

	<!-- presentation part -->
	<prop name="Title" id="title" />

	<!-- Creation Step -->
	<inst id="_1" template="com.gdo.project.model.StepStcl">
		<prop name="Title" id="step1.title" />
		<prop name="Render" id="step1.render" />
	</inst>

	<plug ref="_1" key="1" slot="Steps" />

</template>