<?xml version="1.0" encoding="utf-8"?>

<!DOCTYPE template PUBLIC
  "-//StudioGdo//DTD Stencil 1.0//EN" "stencil.dtd">

<template java="com.gdo.resource.model.DirectResourcesMgrStcl">

	<description>
		A resources manager which resources are directly the files and folders of the contexts.
	</description>
	
	<!-- default template for file/folder -->
	<prop name="FolderTemplate" type="string"><data>com.gdo.resource.model.DirectFolderResourceStcl</data></prop>
	<prop name="FileTemplate" type="string"><data>com.gdo.resource.model.DirectFileResourceStcl</data></prop>

	<!-- resources managed -->
	<slot name="FileResources" arity="*" calculated="true">
		<description>Delegated to Contexts/FilesOnly</description>
	</slot>
	<slot name="FolderResources" arity="*" calculated="true">
		<description>Delegated to Contexts/FoldersOnly</description>
	</slot>
	
</template>
