<?xml version="1.0" encoding="utf-8"?>

<!DOCTYPE template PUBLIC
  "-//StudioGdo//DTD Stencil 1.0//EN" "stencil.dtd">

<template java="com.gdo.resource.model.DirectFolderResourceStcl">

	<description>
		The resource is directly created from the folder contained in the FolderEncapsulted.
	</description>
	<slot name="FolderEncapsulated" arity="1"/>

	<slot name="File" delegate="FolderEncapsulated"/>
	
	<!-- default template for file/folder -->
	<prop name="FolderTemplate" type="string"><data>com.gdo.resource.model.DirectFolderResourceStcl</data></prop>
	<prop name="FileTemplate" type="string"><data>com.gdo.resource.model.DirectFileResourceStcl</data></prop>

	<!-- resources managed -->
	<slot name="FileResources" calculated="true"/>
	<slot name="FolderResources" calculated="true"/>
	
</template>
