<?xml version="1.0" encoding="utf-8"?>

<!DOCTYPE template PUBLIC
  "-//StudioGdo//DTD Stencil 1.0//EN" "stencil.dtd">

<template java="com.gdo.project.Stcl">

	<slot name="label" arity="*">
		<description>List of label facets (mode as key)</description>
		<proto classes="com.gdo.stencils.prop.IProperty" />
	</slot>

	<slot name="panel" arity="*">
		<description>List of label facets (mode as key)</description>
		<proto classes="com.gdo.stencils.prop.IProperty" />
	</slot>

	<slot name="tree" arity="*">
		<description>List of label facets (mode as key)</description>
		<proto classes="com.gdo.stencils.prop.IProperty" />
	</slot>

	<slot name="flex" arity="*">
		<description>List of label facets (mode as key)</description>
		<proto classes="com.gdo.stencils.prop.IProperty" />
	</slot>

	<slot name="model" arity="*">
		<description>List of label facets (mode as key)</description>
		<proto classes="com.gdo.stencils.prop.IProperty" />
	</slot>

</template>
